70,런웨어(Runware),"돈 캐피털(Dawn Capital), 스피드인베스트(Speedinvest), 컴캐스트 벤처스(Comcast Ventures), 인사이트 파트너스(Insight Partners), a16z 스피드런, 제로 프라임 벤처스(Zero Prime Ventures), 비긴 캐피탈(Begin Capital)",5000만 달러,Series A,ICT & Digitalization,이미지·비디오·오디오를 실시간으로 생성할 수 있는 AI 미디어 생성 개발자 도구 플랫폼 제공,2025.12.12,버섯돌이(Taehyun Kim),돈 캐피털의 샤밀라 뱅키야 파트너가 이사회 합류,https://wowtale.net/2025/12/12/251805/
71,코넥트,"경기창조경제혁신센터, 알코브인베스트먼트매니지먼트",2.5억 원,미공개,ICT & Digitalization,외국인 대상 여권 기반 통합 생활 플랫폼을 개발하는 AI 스타트업,2025.12.12,확인 불가,경기센터와 알코브 공동 주관 글로벌 펀딩 챌린지 우승으로 투자 유치,https://wowtale.net/2025/12/12/251815/
72,"빌드하다, 스튜디오비비비, 에피코드",에이씨엔디씨,비공개,미공개,ICT & Digitalization,스타트업 3개사에 대한 투자 유치,2025.12.12,와우테일,경기도와 경기도경제과학진흥원 주최 창업혁신공간 컴퍼니빌더 지원사업 일환,https://wowtale.net/2025/12/12/251825/
73,엔엑스엔랩스,"시그나이트, 스마트스터디벤처스",미공개,미공개,Interactive Contents & Media,패션·리테일 콘텐츠 자동화 및 생성형 AI 기술을 활용한 디지털 프로덕션 서비스 제공,2025.12.12,와우테일,,https://wowtale.net/2025/12/12/251837/
74,포트,"제너럴 아틀란틱, 액셀, 베세머 벤처 파트너스, 팀8",1억 달러,Series C,ICT & Digitalization,"내부 개발자 포털(Internal Developer Portal, IDP) 솔루션을 제공하여 개발자들이 필요한 도구와 정보를 한곳에서 접근할 수 있도록 하는 플랫폼 개발",2025.12.12,확인 불가,"기업가치 8억 달러, 누적 투자액 1억5800만 달러",https://wowtale.net/2025/12/12/251844/
75,세비인트,"KKR, Sixth Street, TenEleven, Carrick Capital Partners",7억 달러,Series B,ICT & Digitalization,AI 시대의 아이덴티티 보안 플랫폼을 제공,2025.12.13,버섯돌이(Taehyun Kim),"기업가치 약 30억 달러 평가, KKR 주도, AI 기반 신기능 개발 및 글로벌 확장에 투자",https://wowtale.net/2025/12/13/251875/
76,K2 스페이스,"레드포인트, T. Rowe Price, 헤도소피아, 알티미터, 라이트스피드, 알파인 스페이스 벤처스","2억5,000만 달러",시리즈C,Semiconductor & Industrial,고출력 위성 버스 플랫폼을 개발 및 대량 생산하는 우주항공 스타트업,2025.12.14,버섯돌이(Taehyun Kim),"기업가치 30억 달러 평가, 누적 투자금 4억5,000만 달러 확보",https://wowtale.net/2025/12/14/251884/
77,세인진바이오,"국제 국부펀드, 시노바이오팜, 레전드캐피탈, 비보캐피탈, 인버스, 심비오시스, 국발캐피탈, 트루메드, 레이크블루캐피탈, 일라이 릴리, 치밍벤처파트너스, K2벤처파트너스, TF캐피탈, 오리자홀딩스, 노던라이트벤처캐피탈",1억1000만 달러,시리즈 B,Biotech & Healthcare,간외 조직 표적 RNAi 치료제 개발,2025.12.14,버섯돌이(Taehyun Kim),"일라이 릴리 전략적 투자자 참여, 12억 달러 규모 협력 계약 직후 투자",https://wowtale.net/2025/12/14/251888/
78,퍼보에너지,"B캐피털, 구글, 브레이크스루 에너지 벤처스, 캘스터스, 센타우루스 캐피털, 데본 에너지, 미쓰이, 미쓰비시중공업, JB 스트라우벨, 홀텍 인터내셔널",4.6억 달러,시리즈 E,Biotech & Healthcare,수압파쇄 기술을 접목한 강화지열시스템을 통해 탄소 배출 없는 전력 생산,2025.12.14,확인 불가,"구글이 최초 지분 투자자로 참여, 케이프 스테이션 프로젝트에 투자금 사용",https://wowtale.net/2025/12/14/251891/
79,슈퍼브에이아이,"한화자산운용, 포스코기술투자",140억 원,Pre-IPO,ICT & Digitalization,"사진, 동영상, 3D 라이다 등 영상 AI 솔루션과 데이터 중심 AI 개발 기술 제공",2025.12.15,와우테일,"2026년 IPO 추진, 국내외 대기업과 협력 중",https://wowtale.net/2025/12/15/251916/
80,미렐로,"인덱스 벤처스, 안드레센 호로위츠, 어틀랜틱, 트리플포인트 캐피털",4100만 달러,시드,Interactive Contents & Media,AI 기반 영상에 맞는 사운드 이펙트를 자동 생성하는 오디오 AI 스타트업,2025.12.16,확인 불가,"총 누적 투자금 4400만 달러, AI 비디오 사운드 분야 특화",https://wowtale.net/2025/12/16/251967/
