143,십일리터,"기술보증기금, AC패스파인더",미공개,프리 시리즈A 브릿지,Biotech & Healthcare,반려동물 토탈 건강관리 솔루션 ‘라이펫’ 운영,2026.01.05,와우테일,누적 투자 유치 금액 20억 원 돌파,https://wowtale.net/2026/01/05/252716/
144,엔라이튼,템플턴하나자산운용,300억 원,미공개,ETC,지붕형 태양광 사업을 통해 산업시설 유휴 지붕을 활용한 태양광 설비를 확대 및 운영,2026.01.05,와우테일,,https://wowtale.net/2026/01/05/252721/
145,얼맥당,"스타에셋파트너스, 와이앤아처",미공개,미공개,Consumer Internet & Fintech,스몰비어 프랜차이즈 브랜드로 국산 생맥주 품질 관리와 차별화된 경험 제공,2026.01.06,와우테일,,https://wowtale.net/2026/01/06/252773/
146,세상을바꾸는사람들,젠엑시스,비공개,프리시리즈A,Energy,AI 기반 전력 예측 및 가변전력제어 기술을 개발하여 전기차 충전 인프라 확장과 건물 에너지 관리를 지원,2026.01.06,와우테일,,https://wowtale.net/2026/01/06/252777/
147,위드포인츠,"크릿벤처스, 퓨처플레이, 위벤처스, 은행권청년창업재단(디캠프)",40억원,프리 시리즈A,Semiconductor & Industrial,모듈형 로봇 자동화 플랫폼 개발 및 제조 현장 비정형 작업 자동화 솔루션 제공,2026.01.06,와우테일,"크릿벤처스가 15억원 단독 투자, AI·로보틱스 기반 스마트 제조·물류 전환에 집중",https://wowtale.net/2026/01/06/252794/
148,랩인큐브,메타바이오메드,비공개,전략적 투자,Biotech & Healthcare,MOF 기반 소재 개발 및 의료소재 분야 사업화,2026.01.06,와우테일,,https://wowtale.net/2026/01/06/252813/
149,에봄에이아이,끌림벤처스,비공개,시드,Biotech & Healthcare,심장질환 조기 진단 및 예측 AI 솔루션 개발하는 의료 AI 스타트업,2026.01.07,와우테일,중소벤처기업부 딥테크 팁스 선정으로 15억원 정부 R&D 자금 지원 예정,https://wowtale.net/2026/01/07/252857/
150,리보디스,베이스벤처스,5억 원,시드,Biotech & Healthcare,옷처럼 입는 소프트 웨어러블 로봇을 개발하는 스타트업,2026.01.07,와우테일,,https://wowtale.net/2026/01/07/252861/
151,열다컴퍼니,서울대학교기술지주,비공개,시드,Consumer Internet & Fintech,정명화 기반 구독형 홈케어 플랫폼 운영,2026.01.07,와우테일,,https://wowtale.net/2026/01/07/252864/
152,에이뉴프로덕션,씨엔티테크,미공개,미공개,Interactive Contents & Media,XR·버추얼 기술을 접목한 가족뮤지컬 ‘닥터 두리틀’ 제작,2026.01.07,와우테일,동국대학교기술지주-씨엔티테크 제1호 개인투자조합을 통해 투자,https://wowtale.net/2026/01/07/252894/
153,xAI,"Valor Equity Partners, Stepstone Group, Fidelity Management & Research Company, Qatar Investment Authority, MGX, Baron Capital Group, NVIDIA, Cisco Investments",200억 달러,Series E,ICT & Digitalization,인공지능(AI) 기술 개발 및 AI 슈퍼컴퓨터 인프라 구축,2026.01.08,버섯돌이(Taehyun Kim),"엔비디아와 시스코가 전략적 투자자로 참여, 세계 최대 GPU 클러스터 구축 지원",https://wowtale.net/2026/01/08/252931/
154,엘엠아레나,"펠리시스, UC 인베스트먼츠, 앤드리슨 호로위츠, 더 하우스 펀드, LDVP, 클라이너 퍼킨스, 라이트스피드 벤처 파트너스, 로드 벤처스","1억 5,000만 달러",Series A,ICT & Digitalization,AI 모델 평가 플랫폼을 운영하며 사용자 피드백 기반 AI 모델 성능 평가 서비스를 제공,2026.01.08,확인 불가,"7개월 만에 기업가치 3배 상승, AI 평가 시장 내 차별화된 사용자 참여형 평가 방식",https://wowtale.net/2026/01/08/252938/
155,요양의정석,서울대기술지주,비공개,시드,Biotech & Healthcare,보호자들이 신뢰할 수 있는 요양 정보와 돌봄 자원을 연결하는 AI 기반 시니어 케어 플랫폼,2026.01.08,와우테일,,https://wowtale.net/2026/01/08/252970/
156,커버써먼,인터베스트,미공개,전략적 투자,Consumer Internet & Fintech,스마트 섬유소재 기술을 활용한 패션테크 기업,2026.01.08,와우테일,,https://wowtale.net/2026/01/08/252980/
157,한국딥러닝,"트랜스링크인베스트먼트, SV인베스트먼트, IBK기업은행, 산업은행",120억 원,시리즈A,ICT & Digitalization,공공·기업용 시각지능 AI 통합 솔루션을 제공하는 기업,2026.01.08,와우테일,"산업은행이 50억 원 투자, 총 투자금의 40% 이상 차지",https://wowtale.net/2026/01/08/252985/
158,RXC,"LB인베스트먼트, 제트벤처캐피탈(ZVC), GS벤처스, 한국벤처투자, 에이피알(APR)",70억 원,시리즈A,Interactive Contents & Media,디지털 미디어 기반 커머스 플랫폼 ‘프리즘’ 운영,2026.01.08,와우테일,,https://wowtale.net/2026/01/08/253011/
159,펩,크릿벤처스,10억원,시드,Interactive Contents & Media,하이브리드 캐주얼 게임 개발 및 퍼블리싱,2026.01.09,와우테일,,https://wowtale.net/2026/01/09/253027/
160,한국엘에프피,코인베스트,300만 달러,미공개,Semiconductor & Industrial,이차전지 핵심 소재 분야에서 기술 경쟁력을 보유한 기업,2026.01.09,와우테일,코인베스트는 지난해 10월 초기 투자(20만 달러) 후 추가 투자,https://wowtale.net/2026/01/09/253031/
161,코기,"와이 콤비네이터, 킨드레드 벤처스, 올리버 융, 레블론 캐피털, 컨트래리, 글레이드 브룩 캐피털 파트너스",1억 800만 달러,"시리즈 A, 시드 라운드",Consumer Internet & Fintech,스타트업 전문 AI 보험 플랫폼으로 보험사 라이선스를 보유하고 AI 기반 보험 상품과 서비스를 제공,2026.01.09,확인 불가,"설립 1년 만에 정식 보험사 라이선스 취득, AI를 핵심 인프라로 활용",https://wowtale.net/2026/01/09/253037/
162,프로테제,"안드레센 호로위츠, 풋워크, CRV, 블룸버그 베타, 플렉스 캐피탈, 셰이퍼 캐피탈",3천만 달러,Series A,ICT & Digitalization,AI 개발사와 데이터 제공자를 연결하는 AI 학습 데이터 플랫폼을 운영,2026.01.11,버섯돌이(Taehyun Kim),"지난해 8월 2,500만 달러 시리즈 A 후속 투자, 누적 투자액 6,500만 달러",https://wowtale.net/2026/01/11/253058/
163,라이트(Lyte),"아비그도르 빌렌츠, 피델리티, 아트레이데스, 엑소르 벤처스, 키원 캐피탈, 벤처 테크 얼라이언스",1억 700만 달러,미공개,ICT & Digitalization,로봇용 통합 인식 시스템과 4D 센싱 기술을 개발하는 스타트업,2026.01.11,확인 불가,"창립 투자자 아비그도르 빌렌츠가 이끌었으며, CES 2026 로봇 부문 최고 혁신상 수상",https://wowtale.net/2026/01/11/253062/
164,에피바이올로직스,"구글 벤처스(GV), 존슨앤존슨 벤처 캐피털 부문(JJDC), 노바티스 벤처 펀드, 아울리스 캐피털, 아베고 바이오사이언스 캐피털, 삼사라 바이오캐피털, 폴라리스 파트너스, 디지탈리스 벤처스, 타이호 벤처스, 비보 캐피털, 코돈 캐피털, 미션 바이오캐피털",1억700만 달러,Series B,Biotech & Healthcare,"세포 외부 단백질 분해 기술 기반의 이중특이항체 플랫폼을 활용해 암, 면역질환, 신경질환 치료제 개발",2026.01.11,버섯돌이(Taehyun Kim),,https://wowtale.net/2026/01/11/253066/
165,솔리 테라퓨틱스,"서베이어 캐피털, HRTG 파트너스, RWN 매니지먼트, 더그 레온 패밀리 펀드, 브레이어 캐피털, 고든MD 글로벌 인베스트먼트",2억 달러,Series C,Biotech & Healthcare,세포 스트레스 센싱 AI 기반 신약 개발,2026.01.12,확인 불가,,https://wowtale.net/2026/01/12/253080/
166,파라빌리스 메디슨즈,"RA 캐피털 매니지먼트, 피델리티 매니지먼트 앤 리서치 컴퍼니, 야누스 헨더슨 인베스터스",3억 5백만 달러,Series F,Biotech & Healthcare,"베타-카테닌을 표적으로 하는 임상단계 바이오 제약사로, 헬리콘 플랫폼을 활용해 암 치료제 개발",2026.01.12,버섯돌이(Taehyun Kim),베타-카테닌 표적 치료제 개발에 성공한 희귀 및 일반 종양 대상 파이프라인 확장 목적,https://wowtale.net/2026/01/12/253083/
167,솔라토즈,서울대학교기술지주,비공개,미공개,Semiconductor & Industrial,폐 태양광패널을 업사이클링해 고부가가치 농업 인프라용 에코강화유리와 에코솔라패널을 생산,2026.01.12,와우테일,,https://wowtale.net/2026/01/12/253108/
168,SDT,"프랙시스캐피탈파트너스, NH투자증권",300억 원,미공개,Biotech & Healthcare,AI·양자 하이브리드 인프라 구축 및 차세대 컴퓨팅 솔루션 제공,2026.01.12,와우테일,기술특례상장 및 연내 IPO 목표,https://wowtale.net/2026/01/12/253110/
169,플로라운지,씨엔티테크,미공개,프리시리즈A 후속 투자,Consumer Internet & Fintech,AI 기반 수요예측과 자체 유통 인프라를 활용한 O2O 화훼 유통 및 플라워테크 서비스 제공,2026.01.12,와우테일,한국농업기술진흥원 농식품 벤처육성 지원사업 발굴 사례,https://wowtale.net/2026/01/12/253137/
170,하르마탄 AI,다쏘 애비에이션,2억 달러,Series B,ICT & Digitalization,"방산용 자율비행 AI 및 드론, 전자전 장비, 지휘통제 플랫폼 개발",2026.01.13,확인 불가,"프랑스 방산 스타트업 최초 유니콘 등극, 다쏘 주도 투자",https://wowtale.net/2026/01/13/253159/
